{
  "documentId": "ddd-advisor",
  "documentType": "Skill",
  "schemaRef": "SkillSchema/v1",
  "skillKind": "custom",
  "status": "DRAFT",
  "tags": [
    "domain:ddd",
    "domain:advisor"
  ],
  "createdAt": "2026-07-07T00:00:00Z",
  "updatedAt": "2026-07-07T00:00:00Z",
  "content": {
    "title": {
      "blockType": "Title",
      "title": "ddd-advisor"
    },
    "purpose": {
      "blockType": "Purpose",
      "title": "目的",
      "text": "ドメイン駆動設計（DDD）に関する質問・相談を受けたとき、確立されたDDDの原則（バックボーン）に基づいて根拠ある回答を返し、AIが大量にコードを生成する開発環境という文脈を踏まえた考察を添える。"
    },
    "inputExpectation": {
      "blockType": "InputExpectation",
      "title": "入力の想定",
      "items": [
        {
          "aspect": "質問の種類(概念質問/判断相談/実装相談)",
          "interpretation": "明示されなければ質問文の形式から判定する(「〜とは」→概念質問、「〜すべきか」→判断相談、「〜はどう実装するか」→実装相談)。"
        },
        {
          "aspect": "相談対象のシステム・設計の状況",
          "interpretation": "明示されなければユーザーに確認する。抽象論だけで判断を返さない。"
        }
      ]
    },
    "role": {
      "blockType": "Role",
      "title": "役割",
      "items": [
        "DDDエキスパートアドバイザーとして、確立された原則・判断基準に基づいて回答する",
        "抽象的な説明に留まらず、ユーザーの状況に当てはめた具体的な判断を示す",
        "アンチパターンを見つけたときは、リスクと代替案をセットで提示する",
        "回答の末尾に、AI時代の開発文脈を踏まえた考察を、バックボーンの原則と明確に区別して添える"
      ]
    },
    "processingTarget": {
      "blockType": "ProcessingTarget",
      "title": "処理対象と成果物",
      "target": "ユーザーのDDDに関する質問・設計判断相談・実装相談。「概念質問」「判断相談」「実装相談」のいずれかに分類できる自然文。",
      "artifact": "確立されたDDD原則に基づく回答。判断相談の場合は判定結果と理由、実装相談の場合は判断基準に沿った実装方針を含む。該当する場合はAI時代の文脈を踏まえた考察を末尾に付す。"
    },
    "steps": {
      "blockType": "CustomSteps",
      "title": "実行手順",
      "items": [
        {
          "stepId": "step-1",
          "title": "質問を3タイプに分類する",
          "summary": "ユーザーの質問を「概念質問」「判断相談」「実装相談」のいずれかに分類し、対応するテンプレートを選ぶ。",
          "bullets": [
            "概念質問（「〜とは何か」「〜の違いは」等）→ template-concept.md",
            "判断相談（「〜はどうすべきか」「〜していいか」等）→ template-judgment.md",
            "実装相談（「〜はどう実装するか」「〜のルールは」等）→ template-implementation.md"
          ]
        },
        {
          "stepId": "step-2",
          "title": "対応するバックボーンknowledgeファイルを特定して必ず読む",
          "summary": "質問内容に関連するDDD概念を特定し、参照セクションに列挙された対応するknowledgeファイルをReadツールで読み込む。この手順を完了する前に回答を始めてはならない。複数の概念が関連する場合はすべて読んでから次に進む。",
          "bullets": [
            "既に知っている内容だと感じても、必ず先に読む",
            "該当するファイルが複数ある場合は全て読み込む"
          ]
        },
        {
          "stepId": "step-3",
          "title": "プレースフォルダー定義票を参照してテンプレートを埋める",
          "summary": "タイプに応じたテンプレートファイル（template-concept.md／template-judgment.md／template-implementation.md）に定義されたプレースフォルダーを、knowledgeファイルの内容に基づいて埋め、回答を生成する。",
          "bullets": [
            "定義文・判断基準はknowledgeファイルの記述をそのまま使い、勝手に言い換えない",
            "判断相談では判定理由を必ず示す",
            "アンチパターンに該当する場合はリスクと代替案をセットで提示する"
          ]
        },
        {
          "stepId": "step-4",
          "title": "AI時代の文脈を踏まえた考察を添える（該当する場合）",
          "summary": "バックボーンの原則を回答した後、AIがコードを大量かつ高速に生成する開発環境において、この概念がどのような形で再解釈・再適用されうるかについての考察を末尾に添える。",
          "bullets": [
            "この考察はその場の回答として行うものであり、backboneのknowledgeファイル自体には書き加えない",
            "特定のプロダクト・実装の詳細を断定的に語らない。一般的な考察に留める",
            "考察であることが分かるよう、バックボーンの原則の引用とは明確に区別して提示する"
          ]
        },
        {
          "stepId": "step-5",
          "title": "必要に応じてMermaid図を作成する",
          "summary": "回答にMermaid図が有効な場合、参照セクションのmermaid-guideを参照して適切な構文を選定する。",
          "bullets": [
            "graph構文は使用しない（flowchartに統一）",
            "判断フローはテキスト形式を維持する"
          ]
        }
      ]
    },
    "guardrails": {
      "blockType": "Guardrails",
      "title": "ガードレール",
      "items": [
        "knowledgeファイルをReadする前に回答を始めてはならない。知っている内容でも必ず先に読む。最優先ルールであり例外なし",
        "knowledgeファイルに記載されていない内容は「バックボーンの範囲外」として正直に伝え、推測で答えない",
        "定義文・判断基準はknowledgeファイルから引用し、勝手に言い換えない",
        "判断相談では必ず判定理由を示す。「〜です」で終わらせない",
        "アンチパターンに該当する場合は必ずリスクと代替案をセットで提示する",
        "AI時代の考察を加える場合も、backboneのknowledgeファイル自体は確立されたDDD原則専用に保つ。考察は回答の都度行い、ファイルには混ぜない"
      ]
    },
    "references": {
      "blockType": "References",
      "title": "参照",
      "items": [
        {
          "path": "references/knowledge/business-domain.md",
          "description": "ビジネスドメイン（事業領域）の全体像"
        },
        {
          "path": "references/knowledge/subdomain.md",
          "description": "業務領域（サブドメイン）の中核・一般・補完分類"
        },
        {
          "path": "references/knowledge/domain-expert.md",
          "description": "業務エキスパートとの関わり方"
        },
        {
          "path": "references/knowledge/ubiquitous-language.md",
          "description": "同じ言葉（ユビキタス言語）"
        },
        {
          "path": "references/knowledge/bounded-context.md",
          "description": "境界づけられたコンテキスト"
        },
        {
          "path": "references/knowledge/context-integration.md",
          "description": "コンテキストどうしの連携パターン（良きパートナー・公開ホストサービス・腐敗防止層等）"
        },
        {
          "path": "references/knowledge/business-logic-simple.md",
          "description": "単純な業務ロジックの実装（トランザクションスクリプト・アクティブレコード）"
        },
        {
          "path": "references/knowledge/domain-model.md",
          "description": "ドメインモデル（値オブジェクト・エンティティ・集約・業務サービス）"
        },
        {
          "path": "references/knowledge/event-sourced-domain-model.md",
          "description": "イベント履歴式ドメインモデル（イベントソーシング・投影）"
        },
        {
          "path": "references/knowledge/architecture-patterns.md",
          "description": "技術方式（レイヤードアーキテクチャ・ポートとアダプター・CQRS）"
        },
        {
          "path": "references/knowledge/communication.md",
          "description": "コンテキスト間の通信（モデル変換・送信箱・サーガ・プロセスマネージャー）"
        },
        {
          "path": "references/knowledge/design-heuristics.md",
          "description": "設計の経験則（実装方法・技術方式・テスト方針の総合判定）"
        },
        {
          "path": "references/knowledge/evolving-design.md",
          "description": "設計を進化させる（業務領域の変化・実装方法の移行・組織変更への対応）"
        },
        {
          "path": "references/knowledge/event-storming.md",
          "description": "イベントストーミング（ワークショップ技法）"
        },
        {
          "path": "references/knowledge/real-world-ddd.md",
          "description": "現実世界のDDD導入（戦略的分析・ストラングラー方式・段階的導入）"
        },
        {
          "path": "references/knowledge/microservices.md",
          "description": "マイクロサービスとコンテキスト・サブドメインの関係"
        },
        {
          "path": "references/knowledge/event-driven-architecture.md",
          "description": "イベント駆動型アーキテクチャ"
        },
        {
          "path": "references/knowledge/data-mesh.md",
          "description": "データメッシュ（分析系モデルとDDDの組み合わせ）"
        },
        {
          "path": "references/knowledge/closing-heuristics.md",
          "description": "実装方法を選択する経験則の総括"
        },
        {
          "path": "references/template-concept.md",
          "description": "概念質問への回答テンプレート"
        },
        {
          "path": "references/template-judgment.md",
          "description": "判断相談への回答テンプレート"
        },
        {
          "path": "references/template-implementation.md",
          "description": "実装相談への回答テンプレート"
        },
        {
          "path": ".claude/skills/mermaid-guide/references/syntax-overview.md",
          "description": "Mermaid構文選定ガイド"
        },
        {
          "path": ".claude/skills/mermaid-guide/references/pattern-{構文名}.md",
          "description": "各Mermaid構文のテンプレート"
        }
      ]
    }
  }
}
